HypothesisId,Name,Claim,PriorWeight,EvidenceScore,PosteriorLikeScore,SupportLevel,MainSupportingEvidence,MainObjection,DecisiveNextTests
L0,Restricted Administrative/Onomastic Script,"The inscriptions encode restricted names, titles, institutions, commodities, or authority formulae rather than full prose.",0.72,0.736,0.731,Strongly supported,formula_restriction=0.898 x 1.30; context_strength=0.890 x 1.20; prime_entity_strength=0.654 x 1.00; classifier_strength=0.517 x 0.90; suffixing_strength=0.734 x 0.70,A large unresolved sequence class remains and may hide multiple mechanisms.,"Prime-entity fillers must correlate with object, site, emblem, or administrative context. | Terminal and classifier signs must remain functionally stable across sites. | Longer prose-like syntax should remain rare."
L1,Multilingual Administrative Ecology,The system is a shared administrative script with possible language-local names or titles at different sites.,0.6,0.73,0.689,Supported,formula_restriction=0.898 x 1.00; regional_strength=0.733 x 1.20; context_strength=0.890 x 1.10; prime_entity_strength=0.654 x 0.80; classifier_strength=0.517 x 0.80,A large unresolved sequence class remains and may hide multiple mechanisms.,Regional/site distributions should explain units better than one global phonetic inventory. | A core of signs should remain stable while some fillers show site-specific behavior. | Image/context validation should reveal local administrative practices.
L6,Primarily Non-Linguistic Emblem System,The signs are mostly emblematic or administrative symbols with little direct language encoding.,0.42,0.715,0.621,Supported,context_strength=0.890 x 1.30; icon_strength=0.794 x 1.00; formula_restriction=0.898 x 0.90; classifier_strength=0.517 x 0.60; not prime_entity_strength=0.346 x 0.20,Structured prime-entity slots and phonetic-ready minimal pairs are too strong for a purely emblematic account.,Context associations should dominate over internal grammatical structure. | Phonetic anchors should fail to generalize across artifacts. | Minimal pairs should behave as graphic variants rather than linguistic contrasts.
L2,Dravidian-Compatible Linguistic Layer,"Some signs encode a Dravidian or para-Dravidian linguistic layer, probably through suffixing formulae and names/titles.",0.48,0.664,0.605,Supported,suffixing_strength=0.734 x 1.30; prime_entity_strength=0.654 x 1.00; phonetic_readiness_strength=0.583 x 0.90; formula_restriction=0.898 x 0.60; context_strength=0.890 x 0.40,No sign has a validated phonetic value yet; family assignment remains below decipherment threshold.,"Suffix-like terminal signs should attach productively to entity fillers. | A proposed Dravidian morpheme must predict all structural occurrences, not just one sign. | Proper-name or title readings must survive cross-site minimal alternations."
L5,Logo-Syllabic or Logo-Phonetic Writing,The system combines semantic signs with phonetic or syllabic complements.,0.44,0.653,0.585,Supported,phonetic_readiness_strength=0.583 x 1.25; minimal_anchor_strength=0.775 x 1.00; prime_entity_strength=0.654 x 0.80; classifier_strength=0.517 x 0.60; suffixing_strength=0.734 x 0.60,"Minimal-pair evidence exists, but no phonetic complement has been proven.",Minimal pairs should isolate recurring sound-bearing contrasts. | Sign variables should appear in both semantic and phonetic roles. | Allograph compression should preserve phonetic or morphemic structure.
L3,Indo-Iranian/Indo-Aryan Linguistic Layer,"Some signs encode an early Indo-Iranian or Indo-Aryan linguistic layer, probably in names, titles, or ritual/administrative terms.",0.34,0.635,0.541,Plausible but unproven,prime_entity_strength=0.654 x 0.90; phonetic_readiness_strength=0.583 x 1.00; suffixing_strength=0.734 x 0.50; context_strength=0.890 x 0.50; formula_restriction=0.898 x 0.40,No sign has a validated phonetic value yet; family assignment remains below decipherment threshold.,Any reading must be chronology-sensitive and avoid later Sanskrit back-projection. | Inflectional or title morphology must explain terminal signs and minimal pairs. | A proposed name/title must recur in compatible semantic contexts.
L4,Munda/Para-Munda Linguistic Layer,"Some signs encode a Munda-like or para-Munda linguistic layer, potentially with prefixing or mixed morphology.",0.32,0.624,0.527,Plausible but unproven,classifier_strength=0.517 x 0.80; regional_strength=0.733 x 0.70; phonetic_readiness_strength=0.583 x 0.80; suffixing_strength=0.734 x 0.40; context_strength=0.890 x 0.40,No sign has a validated phonetic value yet; family assignment remains below decipherment threshold.,Prefix-like or classifier-like behavior should be stronger than suffix-only analysis. | Regional distributions should fit plausible eastern or contact-zone contexts. | Readings must explain both initial and terminal alternations.
